TITLE,COMPANY_NAME,LOCATION,QUALIFICATIONS,SKILLS,JOBTYPE,,,,
Jaddm,Tehnovolt,"Coimbatore, Tamil Nadu", ['MBA | MSW | PGDM | MA | MCOM |BCOM |BBA | BA Skills'],"['Good communication skill.', 'Data science', 'self confidence', 'Machine learning', 'Web development', 'Web designing', 'positive attitude']","['HR INTERN','Part Time']",,,,
Data Science & ML Engineer,Markytics,"Andheri, Mumbai, Maharashtra",,"['Python', 'Building AI models', 'AWS services.', 'Django', 'SQL']",,,,,
Product Executive/Manager - Pharma,Lord's Mark Biotech Pvt. Ltd.,"Andheri, Mumbai, Maharashtra","['B.Sc, B.Pharm, MBA Industry Type: Pharma Job Type', 'Experience: 2-7 years Location']","['B.Pharm.', 'MBA-Marketing.']",['Full-time'],,,,
Data Science & ML Engineer,Markytics,"Andheri, Mumbai, Maharashtra",,"['AWS services.', 'SQL', 'Django', 'Python', 'Building AI models']",,,,,
Data Science Developer,Leeway Softech,"Andheri, Mumbai, Maharashtra",,"['Self Motivated', 'self motivational', 'positive attitude', 'positive Attitude', 'Leadership']",,,,,
Data Scientist,Athos Systems,"Bandra, Mumbai, Maharashtra",,['data mining'],,,,,
Generative AI - ML Engineers,Lilly,"Bengaluru, Karnataka",['3-10 years of production model deployment experience for ML solutions'],"['data preparation', 'Machine Learning systems', 'developing and designing language understanding/generation systems', 'deep learning', 'AWS ML models', 'math', 'AWS architecture', 'SageMaker', 'NLG algorithms', 'Keras', 'gensim', 'scikit-learn', 'data analytics', 'MLOps frameworks', 'AWS', 'Elasticsearch', 'R', 'data science', 'data collection', 'Java', 'leadership', 'PyTorch', 'Eventbridge', 'algorithms', 'Natural Language Understanding(NLU', 'interpersonal skills', 'Kubeflow', 'probability', 'analytical skills', 'analytics tools', 'teamwork', 'ownership', 'machine learning', 'MLOps pipeline', 'Kubernetes', 'Natural Language Generation(NLG', 'CoreNLP', 'Python', 'Agile Development.', 'NLP/NLG frameworks', 'advanced analytics', 'problem-solving', 'MLFlow', 'statistics', 'Highly motivated', 'Docker', 'large-scale data processing', 'Generative AI', 'cloud-based ML solutions', 'DataRobot', 'computationally intensive statistical modeling', 'TensorFlow', 'Natural Language Technology', 'Natural Language Processing(NLP', 'spacy']",,,,,
Application Architect: MuleSoft,IBM,"Bengaluru, Karnataka",['10+ years as an Integration Architect'],"['time management', 'leadership']",,,,,
BI Architect – R01525271,Brillio,"Bengaluru, Karnataka","['Minimum of 8years authoring high performing, reliable, scalable and secure data visualizations']","['relational database design', 'Azure SQL', 'Financial Services', 'Power BI', 'Excel', 'Power Query', 'PowerBI auditing', 'designing database schemas', 'MDX', 'communication skills', 'Azure Synapse', 'DAX', 'Strong SQL knowledge', 'MS SQL Server BI Stack', 'Power BI administration', 'multidimensional database design', 'cloud computing', 'SQL', 'Microsoft CRM', 'understanding of database fundamentals', 'Power App', 'PowerBI']",,,,,
SAP Basis Architect,IBM,"Bengaluru, Karnataka",['At least 8 years of experience in leading Basis Team and Architect/ SME.'],,,,,,
Experienced Software Engineer -Avionics,BOEING,"Bengaluru, Karnataka","[""Bachelor's degree or higher."", ""Bachelor's degree or higher. Experience in Python.""]","['PDR', 'Ability to understand the big picture', 'CDR', 'TRR', 'Systems Thinking', 'Analytical Skills', 'Develop automated/manual Test scenarios', 'Good understanding of C++', 'Agile development model', 'communications skills', 'automated and functional testing.', 'version control', 'Software integration testing in integration Lab Environment.', 'collect, organize, synthesize, and analyze data', 'Develop test cases and test procedure for High Level and Low-Level Software requirements', 'OOPS concept']",,,,,
Software Engineer II-AI/ML Engineer,"JPMorgan Chase Bank, N.A.","Bengaluru, Karnataka",['Proven experience as a Machine Learning Engineer or similar role'],"['Grafana', 'Bitbucket', 'SageMaker', 'Keras', 'software engineering principles.', 'scikit-learn', 'Bash', 'CloudWatch', 'libraries', 'Spinnaker', 'PyTorch', 'Splunk', 'HADOOP', 'Java applications', 'CI/CD pipelines', 'machine learning frameworks', 'data pipelines', 'AWS apps', 'Kubernetes', 'Cloud Watch', 'Machine Learning models', 'AWS certification', 'deploying and scaling distributed systems', 'Python', 'EMR', 'HTTP', 'jupyter notebooks', 'Redshift', 'Computer science', 'S3 Data Lake', 'Jenkins', 'deploying ML workloads on AWS', 'Sage Maker', 'Machine Learning', 'ML SDLC', 'AWS platform', 'machine learning applications', 'Hive', 'Groovy', 'cloud', 'Dynatrace', 'Java']",,,,,
Logic Design Engineer,IBM,"Bengaluru, Karnataka",['Minimum 10+ years of experience in IT Industry with relevant experience in VLSI design'],"['VLSI Design', 'RISC-V', 'crypto algorithms', 'can-do attitude', 'VHDL / Verilog']",,,,,
Cloud Security Architect,Deloitte,"Bengaluru, Karnataka",['B.Tech/M.Tech/MS/MBA #CA-VT'],"['leadership', 'Terraform', 'Ansible', 'Amazon AWS', 'GCP', 'DevOps/DevSecOps Engineer', 'IaC', 'analytics', 'AWS', 'building and deploying infrastructure-as-code', 'Transparency', 'Google Cloud', 'innovation', 'Strong analytical and problem-solving skills', 'Azure', 'oral and written communication skills', 'AI/ML techniques']",,,,,
Data Analytics Architect,Wipro Limited,"Bengaluru, Karnataka",,"['Metadata Management', 'Conceptual, Logical andphysical database architectures', 'DG', 'leadership', 'Systems Thinking', 'Master Data Management', 'knowledge sharing', 'Deep specialized understanding of theecosystem practice', 'In-depth knowledge of and mastery overecosystem technology', 'Leveraging Technology', 'relational data modelling', 'MDM']",,,,,
Area Manager Sales_South (AI),Bosch Group,"Bengaluru, Karnataka","[""Bachelor's Degree in a Engineering and with a minimum of 8 years’ of relevant experience or the equivalent combination of education and experience Additional Information""]","['Problem Solving', 'Conflict Management Skills', 'Solution Design', 'negotiation', 'management']",,,,,
Conversational AI Lead or Architect,Avaamo,"Bengaluru, Karnataka","['10+ years of work experience with at least 5 years experience in technical pre-sales', 'B.E in Computer Science or relevant field from a top-rated University MBA from a top business school']","['Critical thinking', 'neural networks', 'speech synthesis', 'deep learning']",,,,,
Global Networking Delivery Architect,IBM,"Bengaluru, Karnataka","['10 years’ Experience as a network architect and/or engineer', '12 Years’ experience in Enterprise Networking']",['LAN/WAN and Data center networking.'],,,,,
AI/ ML Lead Architect,Adobe,"Bengaluru, Karnataka",['MS/MTech/B.Tech in Computer Science'],"['Natural Language Processing', 'Spark', 'Keras', 'Deep Learning.', 'SciPy', 'data collection', 'Hadoop', 'PyTorch', 'Scikit-learn', 'algorithms', 'Torch', 'Gensim', 'Pandas', 'machine learning models', 'Recommendation Systems', 'Caffe', 'Tensorflow', 'Python', 'distributed computational frameworks', 'machine learning libraries', 'distributed computing', 'AI/ML', 'Numpy', 'multi-threaded programming', 'Machine Learning', 'NLP models', 'data structures', 'Information retrieval', 'YARN', 'Java']",,,,,
AI-ML Architect,Camsdata,"Bengaluru, Karnataka","['Experience 10 to 15 Yrs', '10+ years of experience developing systems software on Windows or Linux.']","['microservices architecture', 'CUDA programming', 'Deep Learning', 'Python programming', 'developing/training or tuning', 'Hands on experience', 'M Lops', 'C/C++ programming', 'Deep learning', 'building, training and optimizing neural network data analytics', 'DPC++', 'Caffe', 'Pytorch', 'automating deployment, management, scaling, networking with Dockers and Kubernetes.', 'cloud/distributed infrastructure.', 'OpenCL', 'Transfer Learning', 'web service development experience', 'Tens or flow', 'Vino', 'Federated learning techniques.', 'Reinforcement learning', 'Deep Learning frameworks']",,,,,
Experienced Software Engineer,BOEING,"Bengaluru, Karnataka","[""Bachelor's degree or higher Experience in Python"", ""8 to 12 years' related work experience or an equivalent combination of education and experience."", ""Bachelor's degree or higher Typical Education & Experience""]","['TRR', 'Develop automated/manual Test scenarios to test High Level and Low-Level Software requirements', 'SRR', 'Agile development model', 'Systems Thinking', 'version control', 'Develop test cases and test procedure for High Level and Low-Level Software requirements', 'communications skills', 'automated and functional testing', 'CDR', 'Software integration testing', 'collect, organize, synthesize, and analyze data', 'OOPS concept', 'PDR', 'C++', 'Analytical Skills']",,,,,
Lead Technical Product Owner,BOEING,"Bengaluru, Karnataka","[""13 to 16 years’ related work experience or an equivalent combination of education and experience (e.g. Master 12 to 15 years' related work experience Practical knowledge of software requirements development."", ""Master 12 to 15 years' related work experience Export Control Requirements""]","['AWS', 'Kubernetes.', 'Azure.', 'Microsoft Office', 'verbal and written English', 'Flight Management System', 'grammar.', 'Micro services based architecture', 'problem-solving aptitude', 'Docker', 'Distributed systems', 'public cloud', 'Analytical mind', 'story development.', 'Technical Understanding', 'Agile methodology', 'Defect management', 'Euro control B2B feeds']",,,,,
Experienced Scrum Master,BOEING,"Bengaluru, Karnataka","[""8 or more years' related work experience or an equivalent combination of education and experience (e.g. Master +8 years' related work experience."", 'Minimum 8 years’ experience in software development', '8-12 years) Practical knowledge of software requirements development.', 'at least 4-5 years successfully performing Scrum Master Role.']","['Internet and client/server architectures', 'Scrum', 'JAMA', 'XP', 'Micro services based architecture', 'servant leadership style', 'Docker', 'Actor Diagrams', 'guidance to team Humble –', 'Agile-Scrum', 'Crystal', 'Kanban', 'Azure.', 'problem-solving aptitude', 'Agile Games.', 'Analytical mind', 'creative thinking', 'AWS', 'verbal and written English', 'Knowledge of agile methodology', 'Mentorship skills', 'Agile', 'Kubernetes.', 'Microsoft Office', 'Scrum Master', 'grammar.', 'SCRUM MASTER', 'Distributed systems', 'public cloud', 'Technical Understanding', 'Leadership', 'JAMA JIRA Communication']",,,,,
Associate Embedded Avionics Software Engineer,BOEING,"Bengaluru, Karnataka","[""5 to 8 years' related work experience or an equivalent combination of education and experience."", ""E.g. Master + 3 years' related work experience)"", 'Bachelor or Master of Engineering degree and 3+ years of related work experience in Embedded Avionics System Software development, Validation/Verification, Functional Integration and certification.', 'Bachelors or higher degree is required.']","['Project/Build/configuration management tools', 'Agile development processes and tools', 'Atlassian Tool Suites', 'designs algorithms, interfaces, for software systems.', 'Systems Thinking', 'version control', 'communications skills', 'automation strategy', 'test processes', 'Strong Avionics domain knowledge', 'Software Build', 'Python.', 'build and configuration management tools', 'programming skills', 'development/verification process', 'C++', 'Analytical Skills']",,,,,
Associate Manufacturing Engineer,BOEING,"Bengaluru, Karnataka","['Bachelor degree in engineering, preferably in Mechanical / Aerospace / Aviation / Production Engineering from an accredited university with 2-4 years’ experience in aerospace domain Relocation This position offers relocation based on candidate eligibility.']","['Model Based Instructions', 'problem solving', 'written, oral and interpersonal communication skills.', 'MS Office tools', 'fluent in written and spoken English', 'positive attitude']",,,,,
Associate Software Engineer in Test,BOEING,"Bengaluru, Karnataka",['6 or more years of related work experience or an equivalent combination of education and experience (e.g. Masters +5 years of related work experience)'],"['Azure Monitor', 'Microservice architecture', 'system monitoring tools', 'RabbitMQ', 'UI', 'Knowledge of Entity Framework Core', 'Scrum/Agile development', 'Knowledge of Relational Databases', 'static analysis tools', 'testing API', 'TypeScript', 'Good English skills', 'unit testing frameworks', 'MSSQL', 'test automated framework/automated tests', 'Synopsys Coverity', 'C#', 'SonarQube', 'CI/CD pipelines', 'TestCafe', 'CI/CD tools', 'Azure AppInsight)', 'xUnit', 'REST API principles', 'Jasmine', 'Agile Test Matrix', 'automated testing frameworks']",,,,,
Experienced Electronic System Design & Analysis Engineer,BOEING,"Bengaluru, Karnataka","['Bachelor, Master or Doctorate of Science degree from an accredited course of study, in engineering, computer science, mathematics, physics or chemistry 8 years of experience in Systems Electronics Work experience in systems engineering- Electronics', ""Bachelor's in engineering degree or higher 8+ years experience' with Bachelors in Electrical/Electronics Engineering or experience or 6+ years years experience' with Masters in Electrical/Electronics Engineering or any equivalent degree Relocation""]","['mentor and guide subordinates and partners to accomplish project and departmental goals and objectives.', 'written and verbal communication skills', 'written English', 'Communication', 'Systems engineering experience', 'positive demeanor', 'Ability to understand the big picture', 'prepare comprehensive reports, proposals, Statements of Work, and connect technology to business considerations (e.g., ROI)', 'proficient in English', 'communication style.', 'MS Office tools.']",,,,,
Experienced Mechanical Design and Analysis Engineer,BOEING,"Bengaluru, Karnataka","[""Bachelor's degree or higher"", ""Bachelor from accredited university in engineering preferably in Mechanical / Aerospace Aeronautical with typically 9 to 12 years' related work experience or an equivalent combination of education and experience (e.g. Master+8 years of related work experience etc.""]","['Mechanical Engineering', 'fluent in written and spoken English.', 'Electrical Engineering', 'Tubing', 'mechanical design', 'Part design', 'written, verbal and interpersonal communication skills.', 'Geometric dimension and tolerance', 'material properties', 'Sheet metal', 'stress analysis', 'Drafting Proficiency', 'Sheet metal design', 'Unigraphics/NX, Solid works)', 'Assembly design', 'structural design', '3-D Computer Aided Engineering tools', 'Model Based Definition and PLM software', 'DFM', 'Generative shape design']",,,,,
Lead Electrical Design & Analysis Engineer,BOEING,"Bengaluru, Karnataka","[""Bachelor's degree in Electrical/Electronics/Electronics & Communication / Mechanical or higher"", ""acquired through advanced education (e.g. Bachelor) and typically 13 to 16 years' related work experience or an equivalent combination of education and experience (e.g. Master+12 years of related work experience etc."", '13 to 16 Years of major experience in Electrical wire harness design & development lifecycle']","['guidance and mentoring team', 'configuration management', 'Self-motivated', 'Electrical system architecture design', 'AC analysis', 'DC Analysis', 'ENOVIA VPM', 'Catia V5 tool', 'wiring design & harness design.', 'Electrical Wire harness Installation', 'wiring and harness design.', 'written, oral and interpersonal communication skills', 'English.']",,,,,
Experienced Propulsion Engineer,BOEING,"Bengaluru, Karnataka","[""advanced technical education from an accredited course of study in engineering (e.g. Bachelor) and typically 8-11 years of related work experience or an equivalent combination of technical education and experience (e.g. Master+7 years' related work experience)"", 'Bachelors in Mechanical/Aerospace engineering with 8-11 years of Experience.']","['written and verbal communication', 'Geometric Dimensioning and Tolerancing', 'design/analysis processes', 'interpersonal skills', 'multi-functional teaming', 'collaborative problem solving', 'problem-solving skills', 'CATIA', 'Model Based Definition', 'self-motivated', '3-D Computer Aided Design tools', 'Nacelle Structures']",,,,,
AI/ML Engineer - Intern,VDiSTiE,"Bengaluru, Karnataka",['Intern (3-6 months)'],"['CSS', 'jQuery.', 'Good interpersonal skills.', 'Understanding of SEO principles.', 'JavaScript', 'Understanding of key design principles.', 'creative thinking', 'problem-solving skills.', 'Understanding of server-side CSS.', 'HTML', 'verbal communication skills.']",,,,,
AI-ML Engineer,Siemens,"Bengaluru, Karnataka","['2-3 years of relevant experience in machine learning.', 'Bachelor’s or master’s degree in Statistics, Mathematics, Computer Science, or any other quantitative field.']","['Deep Learning algorithms.', 'Selection of right learning algorithm', 'Graph DB', 'querying databases', 'statistical techniques', 'exploratory analysis', 'computer vision', 'BI tools', 'Natural Language Processing.', 'Data Preparation', 'understanding of power and energy domain.', 'Exploratory analysis', 'Flask', 'Django', 'Conceptual understanding of Machine Learning', 'Numpy', 'hyper-parameter tuning', 'Web Frameworks', 'Pandas', 'Matplotlib.', 'cloud computing platforms', 'AWS Sagemaker.', 'Python.', 'FastAPI', 'Feature Engineering', 'SQL.']",,,,,
Associate Software Engineer - Full Stack,BOEING,"Bengaluru, Karnataka","[""5-8 years) Education/experience typically acquired through advanced education (e.g. Bachelor) and typically 5 or more years' related work experience or an equivalent combination of education and experience (e.g. Master +7 years' related work experience."", ""5 or more years' related work experience or an equivalent combination of education and experience (e.g. Master +7 years' related work experience.""]","['HTML 5', 'REST', 'Angular', 'Redux', 'JavaScript', 'Security Progressive Web App Development', 'Session and Exception Handler', 'Power BI', 'PWA concepts', 'CSS', 'Restful API’s', 'Java', 'Spring', 'JSON', 'Springboot', 'Angular coding', 'REST API', 'Async calls', 'XML.', 'MVC', 'bootstrap', 'Karma', 'Azure Cosmos DB Authentication', 'npm', 'Typescript', 'Angular 9 RDBMS', 'Sync', 'NodeJS', 'Certification in Azure cloud Certification on Power BI', 'SASS', 'JPA', 'PostgreSQL NoSQL', 'Jasmine', 'Angular Materials', 'indexDB']",,,,,
Lead Embedded Avionics Software Engineer,BOEING,"Bengaluru, Karnataka","[""Technical Bachelor's degree or Master degree"", ""12 years' related work experience or an equivalent combination of education and experience (e.g. Master + 11 years' related work experience.""]","['C/C++', 'RTOS', 'Flight Management Systems', 'writing and developing software', 'self-starter', 'Python.', 'Linux or Unix experience', 'programming knowledge', 'Flight Management Systems.', 'Real Time Operating System']",,,,,
AI / ML Engineer,Chiplogic Technologies,"Bengaluru, Karnataka","['degree in Computer Science, Mathematics or similar courses or fields']","['Train and retrain systems', 'Machine Leaning Jobs', 'interpersonal skills', 'Knowledge on basics of math and probability', 'Self motivated', 'Python', 'Good understanding and strong knowledge in algorithms and statistics', 'software architecture', 'C/C++', 'Developing deep learning systems', 'presentation skills', 'Designing machine learning programs', 'machine learning experiments and test', 'data modelling', 'Good communication skill', 'data structures.', 'communication', 'Creative problem solving', 'Good understanding on the fundamentals of Artificial Intelligence.']",,,,,
Intern,Vodafone,"Bengaluru, Karnataka",,"['AI', 'communication skills', 'Communication', 'Data Analytics', 'Data Modelling', 'AR', 'Data Visualisation', 'Deep and Machine Learning', 'Data Management']",,,,,
Ai Intern,AlphaICs,"Bengaluru, Karnataka",['Bachelor / Master degree in computer science or AI related field with excellent academic records'],"['Image recognition.', 'Github/ Kaggle profile', 'deep learning frameworks', 'AI edge inference', 'reinforcement learning.', 'good understanding of deep learning', 'CUDA or GPU computation', 'Object detection', 'advanced mathematical concepts', 'natural language processing', 'Tensorflow', 'documentation skills.', 'reinforcement learning', 'Artificial Intelligence', 'C/C++/Python.', 'Computer Vision', 'AI/Deep Learning', 'ICML', 'good academic record', 'Pytorch', 'communication', 'mathematical foundation and applied research experience in machine learning and deep learning']",,,,,
ML Intern,Crediwatch,"Bengaluru, Karnataka",,"['Machine Learning', 'Statistical Data Analysis', 'Python Framework', 'Keras', 'Problem solving skills', 'Deep Learning Architectures', 'SQL', 'Model Building', 'Benchmarking', 'C++', 'Matplotlib', 'Data Analysis', 'Dask', 'Coding Skills', 'Java', 'NLP Frameworks', 'Linux development environment', 'Tensorflow', 'Statistical analyze', 'Object Oriented Methodology', 'Model Tuning', 'R', 'NumPy', 'code versioning tools', 'OpenCV', 'Pandas', 'Computer Vision Skills', 'analytical skills', 'python', 'Scala']",,,,,
SDE Intern,Xeno Software,"Bengaluru, Karnataka","['a degree in Computer Science, Software Engineering, or a related field']","['accountable', 'Good communication', 'Strong understanding of data structures.', 'MySQL', 'interpersonal skills', 'MongoDB', 'Node.js', 'problem-solving skills', 'Java', 'Strong understanding of object-oriented programming concepts']",,,,,
Financial Analysis Intern,Discover Dollar,"Bengaluru, Karnataka","['BCom/BBA in bachelor’s degree Candidate should have 0 – 2 years of experience', 'Experience 0-1 year', 'master’s degree.']","['verbal and writing communication', 'strong in analytical skills']",,,,,
Intern - Airframe - M&P,Airbus,"Bengaluru, Karnataka",,"['machine learning', 'Interpersonal skills.', 'deep learning techniques', 'Material Engineering background', 'Python programming']",,,,,
Information Security Analyst Intern,Discover Dollar,"Bengaluru, Karnataka","[""Bachelor's or Master’s degree in IT/ Computer Science  Work Experience 0-1 year"", 'Minimum experience of zero to one year in information security domain', ""Bachelor's or Master’s degree in a related field""]","['organizing skills', 'planning', 'communication skills', 'information systems', 'self-motivated', 'Good team player']",,,,,
Research Intern,EY,"Bengaluru, Karnataka",,"['AI', 'interpersonal skills', 'IoT', 'collaborative management style', 'PowerPoint', 'computer skills']",,,,,
APPLIED ML INTERN,Third-AI,"Bengaluru, Karnataka",,"['logically minded', 'Multi-Tasking ability', 'Power Point Interpersonal and people management skill', 'MS-Excel', 'Highly motivated', 'MS-Word', 'highly organized']",,,,,
Artificial Intelligence Intern,Fresko Innovation Labs,"Bengaluru, Karnataka","['third or fourth-year students from one of computer science, AI or Masters in these areas.', 'Third or fourth year students from one of computer science, information science or Masters in these areas.', 'Experience - 0-6 months Training cum internship Internship duration - 3-6 months Internship types - Full time ,Unpaid ,Remote Joining']",['Machine Learning Learning Deep Learning Computer vision Segmentation Instance Segmentation Image Preprocessing Time Series.'],,,,,
Computer Vision Engineer (Intern),Stylumia Intelligence Technology,"Bengaluru, Karnataka","['A Bachelor’s/Master’s degree in Computer Science, Information Technology, Electrical Engineering, Statistics, or related field.']","['Generative Learning', 'problem-solving skills', 'deep learning frameworks', 'Pytorch/Tensorflow.', 'computer vision', 'machine learning', 'Data Science', 'Self-Supervised and Semi-Supervised learning.', 'Segmentation', 'deep learning algorithms.', 'Feature Extraction/Representation Learning', 'Neural network workload analysis', 'GANs', 'data science minds', 'computer vision technology', 'Natural Language Processing', 'ownership capabilities', 'Computer Vision', 'Visual Recognition', 'Python.', 'SOTA models', 'deep learning concepts']",,,,,
AI Software Engineer,AlphaICs,"Bengaluru, Karnataka",['Bachelor / Master degree in computer science or AI related field with excellent academic records'],"['Image recognition.', 'Github/ Kaggle profile', 'deep learning frameworks', 'Solid understanding', 'reinforcement learning.', 'good understanding of deep learning', 'CUDA or GPU computation', 'Object detection', 'advanced mathematical concepts', 'natural language processing', 'Tensorflow', 'communication and documentation skills', 'AI/Deep Learning Research', 'reinforcement learning', 'Artificial Intelligence', 'hands on experience with C/C++/Python.', 'Computer Vision', 'good academic record', 'Pytorch', 'mathematical foundation and applied research experience in machine learning and deep learning']",,,,,
Software - Intern,MergerWare,"Bengaluru, Karnataka","[""final year in college or university graduate/Master's program Experience and understanding of Enterprise software development, B2B SaaS Software, quality and DevOps operations Team player.""]","['NoSQL', 'Meteor JS', 'javascript frameworks', 'Self-motivated', 'DOM manipulation', 'EcmaScript Experience', 'MongoDB', 'software architecture', 'JavaScript object model', 'Push Notification', 'Node JS', 'RESTful APIs', 'JavaScript', 'JSON Web Token', 'authorization mechanisms', 'Automate unit and integration tests using low and high-level automation technologies', 'data structure']",['Full time'],,,,
Engineering Manager,Sourcewiz,"Bengaluru, Karnataka",,['communication skills'],"['Full-time, Regular / Permanent Salary']",,,,
